{
  "schema_version": "1.0.0",
  "pack_id": "mini-ux",
  "pack_version": "0.1.0",
  "profile_ids": [
    "mini-profile"
  ],
  "rules": [
    {
      "rule_id": "A11Y-1.1.1",
      "obligation_id": "OBL-UX-001",
      "check_ids": [],
      "version": "0.1.0",
      "lifecycle": "research",
      "obligation": "Fixture obligation for UX-001.",
      "authority": {
        "authority_id": null,
        "section": null,
        "modality": null,
        "incorporated_standard": null
      },
      "jurisdiction": "US-federal",
      "applicability": {
        "predicate": "covered",
        "required_facts": [
          "covered"
        ]
      },
      "temporal": {
        "effective": null,
        "transition": [],
        "pending_effective_date": false
      },
      "evaluation": {
        "channels": [
          "human"
        ],
        "required_states": [
          "default"
        ],
        "automatic_pass_scope": "none_in_0.1.0"
      },
      "channel_support": {
        "source": "unsupported",
        "browser": "unsupported",
        "network": "unsupported",
        "model": "unsupported",
        "human": "human",
        "documentary": "unsupported"
      },
      "blind_spots": [
        "Fixture blind spot"
      ],
      "fixtures": {
        "positive": [],
        "negative": [],
        "exception": [],
        "insufficient": [],
        "regression": []
      },
      "remediation_constraints": [
        "preserve_content"
      ],
      "owner_role": "accessibility_lead",
      "severity_default": "high",
      "source_verified_at": "2026-10-15",
      "source_review_status": "research"
    }
  ],
  "normative": false,
  "notes": "Product engineering rules, not legal obligations."
}
